{
  "$schema": "http://json-schema.org/draft-07/schema#",
  "title": "Research Agent Claim",
  "description": "A single verified claim in the research ledger. Every entry in the claims/ directory must conform to this schema.",
  "type": "object",
  "required": [
    "claim_id",
    "submitted_at",
    "submitted_by",
    "claim_text",
    "category",
    "supporting_evidence",
    "falsifier",
    "depends_on",
    "status",
    "retracted"
  ],
  "properties": {
    "claim_id": {
      "type": "string",
      "pattern": "^vms-[0-9]{4}-[0-9]{4}$",
      "description": "Stable identifier of the form vms-YYYY-NNNN. NNNN is zero-padded sequential within the year."
    },
    "submitted_at": {
      "type": "string",
      "format": "date-time",
      "description": "ISO 8601 timestamp of original submission. Never changed after submission."
    },
    "submitted_by": {
      "type": "string",
      "description": "GitHub username or stable identifier of the contributor."
    },
    "claim_text": {
      "type": "string",
      "minLength": 30,
      "maxLength": 2000,
      "description": "What is being asserted. One to three sentences."
    },
    "category": {
      "type": "string",
      "enum": [
        "zodiac",
        "herbal",
        "balneological",
        "pharmaceutical",
        "cosmological",
        "paleography",
        "codicology",
        "calendar",
        "cipher",
        "provenance",
        "structure",
        "morphology",
        "other"
      ]
    },
    "supporting_evidence": {
      "type": "array",
      "minItems": 1,
      "items": {
        "type": "object",
        "required": ["source_id", "passage_reference", "verification_status"],
        "properties": {
          "source_id": {
            "type": "string",
            "description": "Identifier of the source in the corpus."
          },
          "passage_reference": {
            "type": "string",
            "description": "Specific passage being cited. May be a paragraph index, page reference, or direct quote."
          },
          "quoted_text": {
            "type": "string",
            "description": "If a direct quotation, the verbatim text. Subject to verify_quotation check at submission."
          },
          "verification_status": {
            "type": "string",
            "enum": ["pending", "verified", "fuzzy", "failed", "semantic_flag"]
          },
          "verification_similarity": {
            "type": "number",
            "minimum": 0,
            "maximum": 100,
            "description": "Score from the verifier. 100 = exact match. Required if verification_status is fuzzy or failed."
          },
          "verified_at": {
            "type": "string",
            "format": "date-time"
          }
        }
      }
    },
    "falsifier": {
      "type": "string",
      "minLength": 50,
      "description": "Specific condition that would falsify or substantially weaken the claim. Boilerplate falsifiers are rejected by the application."
    },
    "depends_on": {
      "type": "array",
      "items": {
        "type": "string",
        "pattern": "^vms-[0-9]{4}-[0-9]{4}$"
      },
      "description": "List of claim_ids this claim builds on. Retraction of any depended-on claim flags this one for re-verification."
    },
    "status": {
      "type": "string",
      "enum": ["draft", "verified", "flagged", "contested", "retracted"]
    },
    "retracted": {
      "type": "boolean",
      "default": false
    },
    "retraction_reason": {
      "type": ["string", "null"],
      "description": "Required if retracted is true. Explains why the claim was withdrawn."
    },
    "retracted_at": {
      "type": ["string", "null"],
      "format": "date-time"
    },
    "tags": {
      "type": "array",
      "items": {
        "type": "string"
      },
      "description": "Free-form tags for finer-grained categorisation."
    },
    "discussion_notes": {
      "type": "string",
      "description": "Author's notes on the claim's place in the broader argument, context for readers, or open questions."
    }
  }
}
